{
  "schema": "oteryn.premium_snapshot.v1",
  "producer_revision": "0123456789abcdef0123456789abcdef01234567",
  "nonce": "4f1c2a9be07d4c3a8b6e5d4c3b2a1908",
  "account_id": "01890f4e-7c00-7000-8000-000000000001",
  "product_id": "oteryn.premium_time",
  "product_version": 1,
  "entitlement_id": null,
  "entitlement_state": "NONE",
  "lifecycle_revision": 0,
  "authority_revision": 1,
  "effective_from": null,
  "effective_until": null,
  "authority_issued_at": "2026-10-01T12:00:00Z",
  "authority_valid_until": "2026-10-01T13:00:00Z",
  "refresh_after": "2026-10-01T12:40:00Z"
}
